{
  "schema_version": "1.0.0",
  "document_type": "mtgo_completeness_range",
  "format": "standard",
  "source": "mtgo",
  "period": {
    "type": "36w",
    "start": "2026-02-09",
    "end": "2026-10-18",
    "weeks": 36
  },
  "matchup_coverage": {
    "formula_version": "videre-range-coverage-v1",
    "status": "available",
    "period": {
      "start": "2026-02-09",
      "end": "2026-10-18"
    },
    "expected_event_count": 223,
    "available_event_count": 210,
    "deferred_event_count": 0,
    "missing_event_count": 13,
    "excluded_event_count": 0,
    "available_event_ids": [
      "12838092",
      "12838105",
      "12838115",
      "12838123",
      "12838128",
      "12838148",
      "12838158",
      "12838168",
      "12838850",
      "12838863",
      "12838907",
      "12838918",
      "12838929",
      "12839650",
      "12839663",
      "12839682",
      "12839687",
      "12839707",
      "12839956",
      "12840379",
      "12840500",
      "12840519",
      "12840532",
      "12840549",
      "12840554",
      "12840574",
      "12840584",
      "12840594",
      "12840625",
      "12841317",
      "12841322",
      "12841335",
      "12841345",
      "12841353",
      "12841358",
      "12841378",
      "12841388",
      "12841398",
      "12842052",
      "12842065",
      "12842075",
      "12842083",
      "12842088",
      "12842108",
      "12842118",
      "12842128",
      "12842455",
      "12842468",
      "12842478",
      "12842486",
      "12842491",
      "12842511",
      "12842521",
      "12842531",
      "12842875",
      "12842882",
      "12842895",
      "12842905",
      "12842913",
      "12842936",
      "12842946",
      "12842957",
      "12843371",
      "12843385",
      "12843404",
      "12843428",
      "12843438",
      "12843495",
      "12843764",
      "12843777",
      "12843787",
      "12843795",
      "12843800",
      "12843820",
      "12844822",
      "12844835",
      "12844845",
      "12844853",
      "12844858",
      "12844878",
      "12844888",
      "12844909",
      "12845613",
      "12845616",
      "12845634",
      "12845647",
      "12845657",
      "12845665",
      "12845670",
      "12845690",
      "12845700",
      "12845710",
      "12846451",
      "12846464",
      "12846474",
      "12846482",
      "12846487",
      "12846507",
      "12846517",
      "12846527",
      "12847088",
      "12847094",
      "12847107",
      "12847117",
      "12847125",
      "12847148",
      "12847158",
      "12847168",
      "12847673",
      "12847680",
      "12847684",
      "12847697",
      "12847716",
      "12847725",
      "12847734",
      "12848169",
      "12848182",
      "12848192",
      "12848200",
      "12848205",
      "12848225",
      "12848235",
      "12848245",
      "12849423",
      "12849430",
      "12849443",
      "12849453",
      "12849461",
      "12849466",
      "12849486",
      "12849496",
      "12849506",
      "12850613",
      "12850805",
      "12850815",
      "12850823",
      "12851116",
      "12851126",
      "12851135",
      "12851611",
      "12851628",
      "12851641",
      "12851651",
      "12851659",
      "12851664",
      "12851684",
      "12851694",
      "12851725",
      "12852720",
      "12852728",
      "12852733",
      "12852766",
      "12852775",
      "12852807",
      "12853170",
      "12853183",
      "12853190",
      "12853208",
      "12853216",
      "12853225",
      "12853229",
      "12853666",
      "12853674",
      "12853686",
      "12853712",
      "12853721",
      "12853786",
      "12854059",
      "12854067",
      "12854072",
      "12854079",
      "12854097",
      "12854105",
      "12854114",
      "12854118",
      "12854483",
      "12854491",
      "12854496",
      "12854503",
      "12854521",
      "12854529",
      "12854538",
      "12854542",
      "12854913",
      "12854920",
      "12854938",
      "12854946",
      "12855458",
      "12855466",
      "12855471",
      "12855496",
      "12855524",
      "12855542",
      "12855544",
      "12856121",
      "12856130",
      "12856141",
      "12856143",
      "12856152",
      "12856154",
      "12856158",
      "12856183",
      "12856191",
      "12856199",
      "12856204",
      "12856571",
      "12856572",
      "12856581",
      "12856586",
      "12856610"
    ],
    "deferred_event_ids": [],
    "missing_event_ids": [
      "12838882",
      "12838887",
      "12843830",
      "12843840",
      "12844284",
      "12844299",
      "12844309",
      "12844317",
      "12844322",
      "12844341",
      "12844351",
      "12853679",
      "12856137"
    ],
    "excluded_events": [],
    "completeness_rate": 0.941704,
    "unavailable_reason": null
  },
  "high_score_decklist_completeness": {
    "formula_version": "mtgo-high-score-binomial-v1",
    "status": "available",
    "period": {
      "start": "2026-02-09",
      "end": "2026-10-18"
    },
    "eligible_event_count": 223,
    "unsupported_event_count": 0,
    "events": [
      {
        "event_id": "12838092",
        "player_count": 51,
        "round_count": 6,
        "high_score_threshold": 12,
        "minimum_decisive_wins": 4,
        "observed_decklist_count": 17,
        "expected_decklist_count": 17.53125
      },
      {
        "event_id": "12838105",
        "player_count": 52,
        "round_count": 6,
        "high_score_threshold": 12,
        "minimum_decisive_wins": 4,
        "observed_decklist_count": 16,
        "expected_decklist_count": 17.875
      },
      {
        "event_id": "12838115",
        "player_count": 74,
        "round_count": 7,
        "high_score_threshold": 12,
        "minimum_decisive_wins": 4,
        "observed_decklist_count": 31,
        "expected_decklist_count": 37.0
      },
      {
        "event_id": "12838123",
        "player_count": 40,
        "round_count": 6,
        "high_score_threshold": 12,
        "minimum_decisive_wins": 4,
        "observed_decklist_count": 14,
        "expected_decklist_count": 13.75
      },
      {
        "event_id": "12838128",
        "player_count": 48,
        "round_count": 6,
        "high_score_threshold": 12,
        "minimum_decisive_wins": 4,
        "observed_decklist_count": 16,
        "expected_decklist_count": 16.5
      },
      {
        "event_id": "12838148",
        "player_count": 66,
        "round_count": 7,
        "high_score_threshold": 12,
        "minimum_decisive_wins": 4,
        "observed_decklist_count": 28,
        "expected_decklist_count": 33.0
      },
      {
        "event_id": "12838158",
        "player_count": 72,
        "round_count": 7,
        "high_score_threshold": 12,
        "minimum_decisive_wins": 4,
        "observed_decklist_count": 29,
        "expected_decklist_count": 36.0
      },
      {
        "event_id": "12838168",
        "player_count": 74,
        "round_count": 7,
        "high_score_threshold": 12,
        "minimum_decisive_wins": 4,
        "observed_decklist_count": 31,
        "expected_decklist_count": 37.0
      },
      {
        "event_id": "12838850",
        "player_count": 45,
        "round_count": 6,
        "high_score_threshold": 12,
        "minimum_decisive_wins": 4,
        "observed_decklist_count": 14,
        "expected_decklist_count": 15.46875
      },
      {
        "event_id": "12838863",
        "player_count": 46,
        "round_count": 6,
        "high_score_threshold": 12,
        "minimum_decisive_wins": 4,
        "observed_decklist_count": 15,
        "expected_decklist_count": 15.8125
      },
      {
        "event_id": "12838882",
        "player_count": 36,
        "round_count": 6,
        "high_score_threshold": 12,
        "minimum_decisive_wins": 4,
        "observed_decklist_count": 12,
        "expected_decklist_count": 12.375
      },
      {
        "event_id": "12838887",
        "player_count": 39,
        "round_count": 6,
        "high_score_threshold": 12,
        "minimum_decisive_wins": 4,
        "observed_decklist_count": 14,
        "expected_decklist_count": 13.40625
      },
      {
        "event_id": "12838907",
        "player_count": 52,
        "round_count": 6,
        "high_score_threshold": 12,
        "minimum_decisive_wins": 4,
        "observed_decklist_count": 17,
        "expected_decklist_count": 17.875
      },
      {
        "event_id": "12838918",
        "player_count": 64,
        "round_count": 6,
        "high_score_threshold": 12,
        "minimum_decisive_wins": 4,
        "observed_decklist_count": 21,
        "expected_decklist_count": 22.0
      },
      {
        "event_id": "12838929",
        "player_count": 64,
        "round_count": 6,
        "high_score_threshold": 12,
        "minimum_decisive_wins": 4,
        "observed_decklist_count": 21,
        "expected_decklist_count": 22.0
      },
      {
        "event_id": "12839650",
        "player_count": 34,
        "round_count": 6,
        "high_score_threshold": 12,
        "minimum_decisive_wins": 4,
        "observed_decklist_count": 12,
        "expected_decklist_count": 11.6875
      },
      {
        "event_id": "12839663",
        "player_count": 37,
        "round_count": 6,
        "high_score_threshold": 12,
        "minimum_decisive_wins": 4,
        "observed_decklist_count": 12,
        "expected_decklist_count": 12.71875
      },
      {
        "event_id": "12839956",
        "player_count": 32,
        "round_count": 5,
        "high_score_threshold": 9,
        "minimum_decisive_wins": 3,
        "observed_decklist_count": 15,
        "expected_decklist_count": 16.0
      },
      {
        "event_id": "12839682",
        "player_count": 36,
        "round_count": 6,
        "high_score_threshold": 12,
        "minimum_decisive_wins": 4,
        "observed_decklist_count": 12,
        "expected_decklist_count": 12.375
      },
      {
        "event_id": "12839687",
        "player_count": 34,